{"aggregation":"PERCENTILE","algorithm_id":"source-group-disjoint-p95-fit","algorithm_version":"1.0.0","applicable_measurement_ids":["M0-MEAS-01"],"artifact_metadata":{"classification":"GOVERNANCE_ARTIFACT","evidence_claim":"GOVERNANCE_INPUT","fixture_notice":"SYNTHETIC EXAMPLE ONLY; NOT EVIDENCE; NOT A PASS VERDICT"},"authority_effect":"NONE","created_at":"2026-06-01T12:05:15Z","holdout_policy":"VALIDATION_ONLY_NO_RETUNING","input_record_schema":"ylx.stage-evidence-record.v1","method_record_id":"fixture-measurement-method-statistical-fit-m0-meas-01","method_role":"STATISTICAL_FIT","metric_ids":["mjpeg-bitrate-p95-mbps"],"output_contract":"MEASUREMENT_THRESHOLD_TERMS_V1","partition_policy":"REQUIRED_SOURCE_GROUP_DISJOINT","percentile":95,"predecessor_method_record_ref":null,"procedure_steps":["Select only the declared source-group side from the exact partition.","Compute the per-session MJPEG bitrate distribution without holdout retuning.","Return the declared p95 metric in Mbit/s for threshold-term construction."],"publication_protocol":"EXTERNAL_CONTENT_ADDRESSED_LOCATOR_READBACK_V1","publication_readback_schema":"ylx.content-addressed-locator-readback.v1","repetition_rule":"Use every expanded sample in each selected source group exactly once.","revision":1,"schema":"ylx.measurement-method-record.v1","supersession_reason":null}